{
  "name": "horizontal-step-carousel-block",
  "type": "registry:ui",
  "dependencies": [
    "framer-motion",
    "lucide-react"
  ],
  "files": [
    {
      "path": "components/ui/horizontal-step-carousel-block.tsx",
      "type": "registry:ui",
      "content": "'use client';\n\nimport React, { useState } from 'react';\nimport { motion, AnimatePresence} from \"framer-motion\";\nimport { ChevronLeft, ChevronRight, Check } from 'lucide-react';\nimport { cn } from \"@/lib/utils\";\n\nexport interface HorizontalStepCarouselBlockProps {\n  className?: string;\n}\n\nexport const HorizontalStepCarouselBlock: React.FC<HorizontalStepCarouselBlockProps> = ({ className }) => {\n  const [step, setStep] = useState(0);\n\n  const steps = [\n    { title: \"Define Interface\", tag: \"STEP 01\", desc: \"Formulate core design tokens, layout parameters, and accessibility settings.\", color: \"text-purple-500 bg-purple-500/10 border-purple-500/20\" },\n    { title: \"Integrate Shards\", tag: \"STEP 02\", desc: \"Build backend database similarity pipelines with fast sharding layers.\", color: \"text-blue-500 bg-blue-500/10 border-blue-500/20\" },\n    { title: \"Confirm Deploy\", tag: \"STEP 03\", desc: \"Launch to multiple distributed edge servers, verifying system health.\", color: \"text-emerald-500 bg-emerald-500/10 border-emerald-500/20\" },\n  ];\n\n  const shiftStep = (dir: 'prev' | 'next') => {\n    const next = dir === 'prev' ? step - 1 : step + 1;\n    if (next >= 0 && next < steps.length) {\n      setStep(next);\n      if (typeof window !== 'undefined' && navigator.vibrate) navigator.vibrate(10);\n    }\n  };\n\n  return (\n    <div className={cn('relative w-full max-w-[320px] h-[340px] bg-secondary/5 rounded-3xl border border-border flex flex-col justify-between p-5 overflow-hidden select-none', className)}>\n      <div className=\"flex justify-between items-center w-full z-10\">\n        <span className=\"text-[9px] text-muted-foreground font-black tracking-widest uppercase\">Progress Step Carousel</span>\n        <div className=\"flex gap-1.5\">\n          <button\n            type=\"button\"\n            aria-label=\"Previous step\"\n            disabled={step === 0}\n            onClick={() => shiftStep('prev')}\n            className=\"p-1 rounded-lg border border-border bg-card text-muted-foreground hover:bg-secondary/40 disabled:opacity-40 disabled:pointer-events-none transition-all active:scale-90\"\n          >\n            <ChevronLeft className=\"w-3.5 h-3.5\" aria-hidden=\"true\" />\n          </button>\n          <button\n            type=\"button\"\n            aria-label=\"Next step\"\n            disabled={step === steps.length - 1}\n            onClick={() => shiftStep('next')}\n            className=\"p-1 rounded-lg border border-border bg-card text-muted-foreground hover:bg-secondary/40 disabled:opacity-40 disabled:pointer-events-none transition-all active:scale-90\"\n          >\n            <ChevronRight className=\"w-3.5 h-3.5\" aria-hidden=\"true\" />\n          </button>\n        </div>\n      </div>\n\n      <div className=\"relative w-full h-[180px] flex items-center justify-center z-0\">\n        <AnimatePresence mode=\"wait\">\n          <motion.div\n            key={step}\n            initial={{ opacity: 0, x: 20 }}\n            animate={{ opacity: 1, x: 0 }}\n            exit={{ opacity: 0, x: -20 }}\n            className={cn('w-[240px] h-[140px] border rounded-2xl p-4 flex flex-col justify-between bg-card shadow-md', steps[step].color)}\n          >\n            <div className=\"flex justify-between items-start\">\n              <span className=\"text-[8px] font-mono tracking-widest bg-secondary/40 px-2 py-0.5 rounded-full text-foreground/80 uppercase font-black\">{steps[step].tag}</span>\n              <div className=\"w-5 h-5 rounded-full bg-primary/20 flex items-center justify-center text-primary\">\n                <Check className=\"w-3 h-3\" />\n              </div>\n            </div>\n            <div>\n              <h4 className=\"text-xs font-black tracking-wide text-foreground\">{steps[step].title}</h4>\n              <p className=\"text-[9px] text-muted-foreground font-medium leading-relaxed mt-1\">{steps[step].desc}</p>\n            </div>\n          </motion.div>\n        </AnimatePresence>\n      </div>\n\n      {/* Progress Timeline indicators */}\n      <div className=\"w-full flex items-center gap-2 px-1 z-10\">\n        {steps.map((_, idx) => {\n          const isActive = idx <= step;\n          return (\n            <div \n              key={idx} \n              className={cn('h-1 flex-1 rounded-full transition-all duration-300',\n                isActive ? 'bg-primary' : 'bg-border'\n              )}\n            />\n          );\n        })}\n      </div>\n    </div>\n  );\n};\n"
    }
  ]
}