{
  "name": "user-account-menu",
  "type": "registry:ui",
  "dependencies": [
    "framer-motion",
    "lucide-react"
  ],
  "files": [
    {
      "path": "components/ui/UserAccountMenu.tsx",
      "type": "registry:ui",
      "content": "\"use client\";\n\nimport React, { useState } from \"react\";\nimport {\n  User,\n  Settings,\n  CreditCard,\n  Keyboard,\n  LogOut,\n  ChevronDown,\n} from \"lucide-react\";\nimport { cn } from \"@/lib/utils\";\n\ntype Item = { icon: React.ElementType; label: string; shortcut?: string };\n\nconst ITEMS: Item[] = [\n  { icon: User, label: \"Profile\", shortcut: \"⌘P\" },\n  { icon: CreditCard, label: \"Billing\" },\n  { icon: Settings, label: \"Settings\", shortcut: \"⌘,\" },\n  { icon: Keyboard, label: \"Keyboard shortcuts\", shortcut: \"?\" },\n];\n\nexport interface UserAccountMenuProps {\n  className?: string;\n}\n\nexport function UserAccountMenu({ className }: UserAccountMenuProps) {\n  const [open, setOpen] = useState(true);\n\n  return (\n    <div className={cn(\"relative w-full max-w-[240px] font-sans text-foreground\", className)}>\n      <button\n        type=\"button\"\n        aria-haspopup=\"menu\"\n        aria-expanded={open}\n        onClick={() => setOpen((o) => !o)}\n        className=\"flex w-full items-center gap-2.5 rounded-xl border border-border/50 bg-card/60 p-2 pr-3 backdrop-blur-xl transition-colors hover:bg-card\"\n      >\n        <span className=\"flex h-9 w-9 shrink-0 items-center justify-center rounded-full bg-gradient-to-br from-primary to-violet-500 text-xs font-bold text-primary-foreground\">\n          AL\n        </span>\n        <span className=\"min-w-0 flex-1 text-left\">\n          <span className=\"block truncate text-sm font-semibold leading-tight\">Ava Lindqvist</span>\n          <span className=\"block truncate text-xs text-muted-foreground/55\">ava@studio.io</span>\n        </span>\n        <ChevronDown className={cn(\"h-4 w-4 text-muted-foreground transition-transform\", open && \"rotate-180\")} />\n      </button>\n\n      {open && (\n        <div\n          role=\"menu\"\n          aria-label=\"Account menu\"\n          className=\"absolute left-0 z-50 mt-2 w-full overflow-hidden rounded-2xl border border-border/50 bg-card/95 p-1.5 shadow-2xl backdrop-blur-2xl\"\n        >\n          {ITEMS.map((it) => (\n            <button\n              key={it.label}\n              type=\"button\"\n              role=\"menuitem\"\n              className=\"flex w-full items-center gap-2.5 rounded-lg px-2.5 py-2 text-left text-sm font-medium transition-colors hover:bg-foreground/[0.04]\"\n            >\n              <it.icon className=\"h-4 w-4 text-muted-foreground/70\" />\n              <span className=\"flex-1\">{it.label}</span>\n              {it.shortcut && (\n                <span className=\"text-xs text-muted-foreground/40\">{it.shortcut}</span>\n              )}\n            </button>\n          ))}\n\n          <div className=\"my-1 border-t border-foreground/[0.06]\" />\n\n          <button\n            type=\"button\"\n            role=\"menuitem\"\n            className=\"flex w-full items-center gap-2.5 rounded-lg px-2.5 py-2 text-left text-sm font-medium text-rose-600 transition-colors hover:bg-rose-500/10 dark:text-rose-400\"\n          >\n            <LogOut className=\"h-4 w-4\" />\n            <span className=\"flex-1\">Sign out</span>\n          </button>\n        </div>\n      )}\n    </div>\n  );\n}\n"
    }
  ]
}