{
  "name": "tag-chip-input",
  "type": "registry:ui",
  "dependencies": [],
  "files": [
    {
      "path": "components/ui/tag-chip-input.tsx",
      "type": "registry:ui",
      "content": "\"use client\";\n\nimport React, { useRef, useState } from \"react\";\n\nexport interface TagChipInputProps {\n  defaultTags?: string[];\n  placeholder?: string;\n  maxTags?: number;\n  accent?: string;\n  onChange?: (tags: string[]) => void;\n}\n\nconst DEFAULT_TAGS = [\"next.js\", \"react-19\", \"tailwind\"];\n\nexport function TagChipInput({\n  defaultTags = DEFAULT_TAGS,\n  placeholder = \"Add tag…\",\n  maxTags = 8,\n  accent = \"var(--accent)\",\n  onChange,\n}: TagChipInputProps) {\n  const [tags, setTags] = useState(defaultTags);\n  const [value, setValue] = useState(\"\");\n  const inputRef = useRef<HTMLInputElement>(null);\n\n  const update = (next: string[]) => {\n    setTags(next);\n    onChange?.(next);\n  };\n\n  const add = (raw: string) => {\n    const t = raw.trim().toLowerCase().replace(/^#/, \"\");\n    if (!t) return;\n    if (tags.includes(t)) return;\n    if (tags.length >= maxTags) return;\n    update([...tags, t]);\n    setValue(\"\");\n  };\n\n  const remove = (t: string) => update(tags.filter((x) => x !== t));\n\n  const onKey = (e: React.KeyboardEvent<HTMLInputElement>) => {\n    if (e.key === \"Enter\" || e.key === \",\") {\n      e.preventDefault();\n      add(value);\n    } else if (e.key === \"Backspace\" && !value && tags.length) {\n      remove(tags[tags.length - 1]);\n    }\n  };\n\n  const full = tags.length >= maxTags;\n\n  return (\n    <div style={{ fontFamily: \"var(--font-sans)\", width: \"100%\", maxWidth: 380 }}>\n      <div\n        onClick={() => inputRef.current?.focus()}\n        role=\"presentation\"\n        style={{\n          display: \"flex\",\n          flexWrap: \"wrap\",\n          alignItems: \"center\",\n          gap: 6,\n          minHeight: 42,\n          padding: \"6px 8px\",\n          background: \"var(--bg-2)\",\n          border: `1px solid var(--edge-2)`,\n          borderRadius: 10,\n          cursor: \"text\",\n        }}\n      >\n        {tags.map((t) => (\n          <span\n            key={t}\n            style={{\n              display: \"inline-flex\",\n              alignItems: \"center\",\n              gap: 5,\n              height: 26,\n              padding: \"0 6px 0 10px\",\n              background: `color-mix(in srgb, ${accent} 14%, transparent)`,\n              border: `1px solid ${accent}`,\n              borderRadius: 6,\n              color: accent,\n              fontFamily: \"var(--font-mono)\",\n              fontSize: 11.5,\n              animation: \"ai-fade-up 0.28s cubic-bezier(0.16, 1, 0.3, 1) both\",\n            }}\n          >\n            <span>{t}</span>\n            <button\n              type=\"button\"\n              onClick={(e) => {\n                e.stopPropagation();\n                remove(t);\n              }}\n              aria-label={`Remove ${t}`}\n              style={{\n                width: 16,\n                height: 16,\n                display: \"grid\",\n                placeItems: \"center\",\n                background: \"transparent\",\n                border: 0,\n                color: accent,\n                cursor: \"pointer\",\n                borderRadius: 3,\n                fontSize: 11,\n                lineHeight: 1,\n                opacity: 0.7,\n                transition: \"opacity 0.15s ease, background 0.15s ease\",\n              }}\n              onMouseEnter={(e) => {\n                e.currentTarget.style.opacity = \"1\";\n                e.currentTarget.style.background = \"color-mix(in srgb, \" + accent + \" 18%, transparent)\";\n              }}\n              onMouseLeave={(e) => {\n                e.currentTarget.style.opacity = \"0.7\";\n                e.currentTarget.style.background = \"transparent\";\n              }}\n            >\n              ×\n            </button>\n          </span>\n        ))}\n        <input\n          ref={inputRef}\n          type=\"text\"\n          value={value}\n          onChange={(e) => setValue(e.target.value)}\n          onKeyDown={onKey}\n          disabled={full}\n          placeholder={full ? \"Max reached\" : placeholder}\n          aria-label=\"New tag\"\n          style={{\n            flex: 1,\n            minWidth: 80,\n            height: 26,\n            background: \"transparent\",\n            border: 0,\n            color: \"var(--text)\",\n            fontFamily: \"var(--font-sans)\",\n            fontSize: 13,\n            outline: \"none\",\n          }}\n        />\n      </div>\n      <div\n        style={{\n          marginTop: 6,\n          display: \"flex\",\n          justifyContent: \"space-between\",\n          fontFamily: \"var(--font-mono)\",\n          fontSize: 10.5,\n          color: \"var(--text-3)\",\n        }}\n      >\n        <span>Enter or , to add</span>\n        <span style={{ color: tags.length === maxTags ? accent : \"var(--text-3)\" }}>\n          {tags.length} / {maxTags}\n        </span>\n      </div>\n    </div>\n  );\n}\n"
    }
  ]
}