{
  "name": "faq-accordion-section-block",
  "type": "registry:ui",
  "dependencies": [
    "framer-motion",
    "lucide-react"
  ],
  "files": [
    {
      "path": "components/ui/faq-accordion-section-block.tsx",
      "type": "registry:ui",
      "content": "﻿\"use client\";\n\nimport React, { useState } from \"react\";\nimport { motion, AnimatePresence } from \"framer-motion\";\nimport { ChevronDown, HelpCircle } from \"lucide-react\";\nimport { cn } from \"@/lib/utils\";\nimport { usePrefersReducedMotion } from \"./use-animation-hooks\";\n\ntype QA = { q: string; a: string };\n\nconst ITEMS: QA[] = [\n  {\n    q: \"Can I cancel my subscription at any time?\",\n    a: \"Yes. Plans are billed monthly with no long-term contract. Cancel from your billing settings and you keep access until the end of the current period.\",\n  },\n  {\n    q: \"Do you offer a free trial?\",\n    a: \"Every paid plan starts with a 14-day free trial. No credit card is required up front, and you can upgrade or downgrade once you decide.\",\n  },\n  {\n    q: \"How does team billing work?\",\n    a: \"You are charged per active seat. Add or remove members anytime and we prorate the difference automatically on your next invoice.\",\n  },\n  {\n    q: \"Is my data exportable if I leave?\",\n    a: \"Always. You can export your full workspace to CSV or JSON at any moment, and we retain backups for 30 days after cancellation.\",\n  },\n];\n\nexport interface FaqAccordionSectionBlockProps {\n  className?: string;\n}\n\nexport function FaqAccordionSectionBlock({ className }: FaqAccordionSectionBlockProps) {\n  const reduced = usePrefersReducedMotion();\n  const [open, setOpen] = useState<number | null>(0);\n\n  return (\n    <section\n      className={cn(\n        \"w-full max-w-xl bg-card/45 backdrop-blur-xl border border-border/50 p-6 rounded-2xl shadow-xl font-sans text-foreground\",\n        className,\n      )}\n    >\n      <div className=\"flex items-center gap-2 mb-5\">\n        <HelpCircle className=\"w-5 h-5 text-primary\" />\n        <h2 className=\"text-base font-bold\">Frequently asked questions</h2>\n      </div>\n\n      <ul className=\"space-y-2\">\n        {ITEMS.map((item, idx) => {\n          const isOpen = open === idx;\n          return (\n            <li\n              key={item.q}\n              className=\"rounded-xl border border-foreground/[0.05] bg-foreground/[0.02] overflow-hidden\"\n            >\n              <button\n                type=\"button\"\n                aria-expanded={isOpen}\n                onClick={() => setOpen(isOpen ? null : idx)}\n                className=\"w-full flex items-center justify-between gap-3 p-4 text-left transition-colors hover:bg-foreground/[0.03]\"\n              >\n                <span className=\"text-sm font-semibold\">{item.q}</span>\n                <ChevronDown\n                  className={cn(\n                    \"w-4 h-4 shrink-0 text-muted-foreground/60 transition-transform duration-200\",\n                    isOpen && \"rotate-180\",\n                  )}\n                />\n              </button>\n              <AnimatePresence initial={false}>\n                {isOpen && (\n                  <motion.div\n                    initial={reduced ? false : { height: 0, opacity: 0 }}\n                    animate={{ height: \"auto\", opacity: 1 }}\n                    exit={reduced ? { opacity: 0 } : { height: 0, opacity: 0 }}\n                    transition={{ duration: reduced ? 0 : 0.22 }}\n                    className=\"overflow-hidden\"\n                  >\n                    <p className=\"px-4 pb-4 text-sm leading-relaxed text-muted-foreground/75\">\n                      {item.a}\n                    </p>\n                  </motion.div>\n                )}\n              </AnimatePresence>\n            </li>\n          );\n        })}\n      </ul>\n    </section>\n  );\n}\n"
    },
    {
      "path": "components/ui/use-animation-hooks.ts",
      "type": "registry:file",
      "content": "import { useEffect, useRef, useState } from 'react';\nimport type { RefObject } from 'react';\n\nexport const usePrefersReducedMotion = (): boolean => {\n  const [prefersReducedMotion, setPrefersReducedMotion] = useState(false);\n\n  useEffect(() => {\n    const mediaQuery = window.matchMedia('(prefers-reduced-motion: reduce)');\n    setPrefersReducedMotion(mediaQuery.matches);\n\n    const listener = (event: MediaQueryListEvent) => {\n      setPrefersReducedMotion(event.matches);\n    };\n\n    mediaQuery.addEventListener('change', listener);\n    return () => {\n      mediaQuery.removeEventListener('change', listener);\n    };\n  }, []);\n\n  return prefersReducedMotion;\n};\n\nexport const useAnimateOnScroll = (options?: IntersectionObserverInit) => {\n  const [ref, setRef] = useState<HTMLElement | null>(null);\n  const [isIntersecting, setIsIntersecting] = useState(false);\n\n  useEffect(() => {\n    if (!ref) return;\n\n    const observer = new IntersectionObserver(([entry]) => {\n      if (entry) {\n        setIsIntersecting(entry.isIntersecting);\n      }\n    }, options);\n\n    observer.observe(ref);\n    return () => {\n      observer.unobserve(ref);\n    };\n  }, [ref, options]);\n\n  return [setRef, isIntersecting] as const;\n};\n\nexport function useInView<T extends Element = HTMLDivElement>(\n  options: IntersectionObserverInit = { rootMargin: '100px 0px', threshold: 0 },\n): [RefObject<T | null>, boolean] {\n  const ref = useRef<T | null>(null);\n  const [inView, setInView] = useState(false);\n  useEffect(() => {\n    const el = ref.current;\n    if (!el || typeof window === 'undefined' || !('IntersectionObserver' in window)) {\n      setInView(true);\n      return;\n    }\n    const io = new IntersectionObserver(([entry]) => setInView(entry.isIntersecting), options);\n    io.observe(el);\n    return () => io.disconnect();\n  }, [options]);\n  return [ref, inView];\n}\n\nexport function useShouldAnimate<T extends Element = HTMLDivElement>(): [RefObject<T | null>, boolean] {\n  const reduced = usePrefersReducedMotion();\n  const [ref, inView] = useInView<T>();\n  return [ref, inView && !reduced];\n}\n"
    }
  ]
}