{
  "name": "comparison-section",
  "type": "registry:ui",
  "dependencies": [
    "lucide-react"
  ],
  "files": [
    {
      "path": "components/ui/ComparisonSection.tsx",
      "type": "registry:ui",
      "content": "﻿\"use client\";\n\nimport React from \"react\";\nimport { Check, Minus } from \"lucide-react\";\nimport { cn } from \"@/lib/utils\";\n\ntype Plan = \"Starter\" | \"Pro\" | \"Scale\";\n\ntype FeatureRow = {\n  feature: string;\n  values: Record<Plan, boolean | string>;\n};\n\nconst PLANS: Plan[] = [\"Starter\", \"Pro\", \"Scale\"];\n\nconst ROWS: FeatureRow[] = [\n  { feature: \"Team members\", values: { Starter: \"3\", Pro: \"25\", Scale: \"Unlimited\" } },\n  { feature: \"Projects\", values: { Starter: \"10\", Pro: \"Unlimited\", Scale: \"Unlimited\" } },\n  { feature: \"Analytics dashboard\", values: { Starter: false, Pro: true, Scale: true } },\n  { feature: \"Custom roles\", values: { Starter: false, Pro: true, Scale: true } },\n  { feature: \"Audit logs\", values: { Starter: false, Pro: false, Scale: true } },\n  { feature: \"SAML SSO\", values: { Starter: false, Pro: false, Scale: true } },\n];\n\nfunction renderValue(value: boolean | string) {\n  if (typeof value === \"string\") {\n    return <span className=\"text-sm font-medium text-foreground/90\">{value}</span>;\n  }\n  return value ? (\n    <Check className=\"mx-auto h-4 w-4 text-emerald-600 dark:text-emerald-400\" />\n  ) : (\n    <Minus className=\"mx-auto h-4 w-4 text-muted-foreground/30\" />\n  );\n}\n\nexport interface ComparisonSectionProps {\n  className?: string;\n}\n\nexport function ComparisonSection({ className }: ComparisonSectionProps) {\n  return (\n    <div\n      className={cn(\n        \"w-full max-w-2xl bg-card/45 backdrop-blur-xl border border-border/50 rounded-2xl shadow-xl font-sans text-foreground overflow-hidden\",\n        className,\n      )}\n    >\n      <table className=\"w-full border-collapse text-left\">\n        <thead>\n          <tr className=\"border-b border-foreground/[0.06]\">\n            <th className=\"px-4 py-3.5 text-xs font-semibold text-muted-foreground/60\">\n              Compare plans\n            </th>\n            {PLANS.map((plan) => (\n              <th\n                key={plan}\n                className={cn(\n                  \"px-4 py-3.5 text-center text-xs font-bold\",\n                  plan === \"Pro\" ? \"text-primary\" : \"text-foreground/90\",\n                )}\n              >\n                {plan}\n                {plan === \"Pro\" && (\n                  <span className=\"ml-1.5 rounded-full bg-primary/15 px-1.5 py-0.5 text-[11px] font-semibold uppercase text-primary\">\n                    Popular\n                  </span>\n                )}\n              </th>\n            ))}\n          </tr>\n        </thead>\n        <tbody className=\"divide-y divide-foreground/[0.04]\">\n          {ROWS.map((row) => (\n            <tr key={row.feature} className=\"transition-colors hover:bg-foreground/[0.02]\">\n              <td className=\"px-4 py-3 text-sm text-foreground/80\">{row.feature}</td>\n              {PLANS.map((plan) => (\n                <td\n                  key={plan}\n                  className={cn(\"px-4 py-3 text-center\", plan === \"Pro\" && \"bg-primary/[0.04]\")}\n                >\n                  {renderValue(row.values[plan])}\n                </td>\n              ))}\n            </tr>\n          ))}\n        </tbody>\n      </table>\n    </div>\n  );\n}\n"
    }
  ]
}