{
  "name": "stat-delta-spark-card",
  "type": "registry:ui",
  "dependencies": [],
  "files": [
    {
      "path": "components/ui/stat-delta-spark-card.tsx",
      "type": "registry:ui",
      "content": "\"use client\";\n\nimport React, { useMemo } from \"react\";\n\nexport interface StatDeltaSparkCardProps {\n  label?: string;\n  value?: string;\n  delta?: number;\n  series?: number[];\n  unit?: string;\n  accent?: string;\n  period?: string;\n}\n\nconst DEFAULT_SERIES = [12, 14, 13, 17, 16, 22, 24, 23, 28, 32, 31, 38, 42, 48];\n\nexport function StatDeltaSparkCard({\n  label = \"Monthly active users\",\n  value = \"48.2k\",\n  delta = 12.4,\n  series = DEFAULT_SERIES,\n  unit = \"MAU\",\n  accent = \"var(--accent)\",\n  period = \"vs. last 30d\",\n}: StatDeltaSparkCardProps) {\n  const positive = delta >= 0;\n  const deltaColor = positive ? accent : \"var(--pink)\";\n\n  const { path, area, lastX, lastY } = useMemo(() => {\n    const W = 200;\n    const H = 56;\n    const min = Math.min(...series);\n    const max = Math.max(...series);\n    const range = max - min || 1;\n    const dx = W / Math.max(1, series.length - 1);\n    const pts = series.map((v, i) => {\n      const x = i * dx;\n      const y = H - ((v - min) / range) * (H - 8) - 4;\n      return [x, y] as const;\n    });\n    const pathD = pts.map(([x, y], i) => (i === 0 ? `M${x.toFixed(1)},${y.toFixed(1)}` : `L${x.toFixed(1)},${y.toFixed(1)}`)).join(\" \");\n    const areaD = `${pathD} L${W},${H} L0,${H} Z`;\n    const [lx, ly] = pts[pts.length - 1];\n    return { path: pathD, area: areaD, lastX: lx, lastY: ly };\n  }, [series]);\n\n  return (\n    <div\n      role=\"region\"\n      aria-label={`${label}: ${value} ${unit}`}\n      style={{\n        width: \"100%\",\n        maxWidth: 280,\n        background: \"var(--bg-2)\",\n        border: \"1px solid var(--edge-2)\",\n        borderRadius: 14,\n        padding: 16,\n        fontFamily: \"var(--font-sans)\",\n        boxShadow: `0 20px 50px -20px rgba(0,0,0,0.4), 0 0 30px -18px ${accent}`,\n      }}\n    >\n      <div style={{ display: \"flex\", alignItems: \"center\", gap: 8, marginBottom: 8 }}>\n        <span\n          style={{\n            fontFamily: \"var(--font-mono)\",\n            fontSize: 10.5,\n            letterSpacing: \"0.14em\",\n            textTransform: \"uppercase\",\n            color: \"var(--text-3)\",\n          }}\n        >\n          {label}\n        </span>\n        <span\n          style={{\n            marginLeft: \"auto\",\n            fontFamily: \"var(--font-mono)\",\n            fontSize: 9,\n            padding: \"2px 6px\",\n            borderRadius: 3,\n            border: \"1px solid var(--edge)\",\n            color: \"var(--text-3)\",\n            letterSpacing: \"0.1em\",\n          }}\n        >\n          {unit}\n        </span>\n      </div>\n      <div style={{ display: \"flex\", alignItems: \"baseline\", gap: 10 }}>\n        <span style={{ fontSize: 30, color: \"var(--text)\", fontWeight: 600, letterSpacing: \"-0.02em\", lineHeight: 1 }}>{value}</span>\n        <span\n          style={{\n            display: \"inline-flex\",\n            alignItems: \"center\",\n            gap: 3,\n            padding: \"3px 7px\",\n            borderRadius: 999,\n            background: `color-mix(in srgb, ${deltaColor} 16%, transparent)`,\n            color: deltaColor,\n            fontFamily: \"var(--font-mono)\",\n            fontSize: 11,\n            fontWeight: 600,\n          }}\n        >\n          <span aria-hidden=\"true\">{positive ? \"▲\" : \"▼\"}</span>\n          <span>{Math.abs(delta).toFixed(1)}%</span>\n        </span>\n      </div>\n      <svg\n        width=\"100%\"\n        height=\"56\"\n        viewBox=\"0 0 200 56\"\n        preserveAspectRatio=\"none\"\n        style={{ marginTop: 14, display: \"block\" }}\n        aria-hidden=\"true\"\n      >\n        <defs>\n          <linearGradient id=\"spark-grad\" x1=\"0\" y1=\"0\" x2=\"0\" y2=\"1\">\n            <stop offset=\"0%\" stopColor={deltaColor} stopOpacity=\"0.42\" />\n            <stop offset=\"100%\" stopColor={deltaColor} stopOpacity=\"0\" />\n          </linearGradient>\n        </defs>\n        <path d={area} fill=\"url(#spark-grad)\" />\n        <path\n          d={path}\n          fill=\"none\"\n          stroke={deltaColor}\n          strokeWidth=\"1.8\"\n          strokeLinecap=\"round\"\n          strokeLinejoin=\"round\"\n          style={{\n            filter: `drop-shadow(0 0 4px ${deltaColor})`,\n          }}\n        />\n        <circle\n          cx={lastX}\n          cy={lastY}\n          r=\"3\"\n          fill={deltaColor}\n          style={{\n            filter: `drop-shadow(0 0 6px ${deltaColor})`,\n            animation: \"pulse-dot 1.8s ease-in-out infinite\",\n          }}\n        />\n      </svg>\n      <div style={{ marginTop: 8, fontFamily: \"var(--font-mono)\", fontSize: 10.5, color: \"var(--text-4)\", letterSpacing: \"0.06em\" }}>\n        {period}\n      </div>\n    </div>\n  );\n}\n"
    }
  ]
}