{
  "name": "liquid-download-indicator",
  "type": "registry:ui",
  "dependencies": [
    "framer-motion",
    "lucide-react"
  ],
  "files": [
    {
      "path": "components/ui/LiquidDownloadIndicator.tsx",
      "type": "registry:ui",
      "content": "\"use client\";\n\nimport React, { useState, useEffect } from \"react\";\nimport { motion} from \"framer-motion\";\nimport { Download, CheckCircle2 } from \"lucide-react\";\nimport { cn } from \"@/lib/utils\";\n\nexport function LiquidDownloadIndicator({ className }: { className?: string }) {\n  const [progress, setProgress] = useState(0);\n  const [isDownloading, setIsDownloading] = useState(false);\n\n  useEffect(() => {\n    if (!isDownloading) return;\n    const interval = setInterval(() => {\n      setProgress((p) => {\n        if (p >= 100) {\n          clearInterval(interval);\n          setIsDownloading(false);\n          return 100;\n        }\n        return p + 4;\n      });\n    }, 150);\n    return () => clearInterval(interval);\n  }, [isDownloading]);\n\n  const triggerDownload = () => {\n    setProgress(0);\n    setIsDownloading(true);\n  };\n\n  return (\n    <div className={cn(\"w-full max-w-sm rounded-2xl border border-border/80 bg-card/45 p-5 backdrop-blur-xl shadow-2xl flex flex-col items-center space-y-4\", className)}>\n      <div className=\"w-full flex items-center justify-between pb-2 border-b border-border/30\">\n        <div>\n          <h3 className=\"text-sm font-bold text-foreground\">Liquid Loader</h3>\n          <p className=\"text-[10px] text-muted-foreground\">Wave-accumulating download indicator</p>\n        </div>\n        <Download className=\"w-4 h-4 text-primary\" />\n      </div>\n\n      <div className=\"relative w-28 h-28 rounded-2xl border border-border/40 bg-zinc-950/60 overflow-hidden flex items-center justify-center shadow-inner\">\n        {/* Accumulating liquid-like wave fill */}\n        <motion.div\n          animate={{ height: `${progress}%` }}\n          transition={{ type: \"spring\", stiffness: 60, damping: 15 }}\n          className=\"absolute left-0 right-0 bottom-0 bg-primary/25 border-t border-primary/50\"\n        />\n\n        <div className=\"z-10 flex flex-col items-center justify-center text-center\">\n          {progress === 100 ? (\n            <motion.div\n              initial={{ scale: 0.8, opacity: 0 }}\n              animate={{ scale: 1, opacity: 1 }}\n              className=\"text-emerald-400 font-bold text-xs uppercase flex flex-col items-center gap-1\"\n            >\n              <CheckCircle2 className=\"w-6 h-6 shrink-0\" />\n              <span>Complete</span>\n            </motion.div>\n          ) : (\n            <span className=\"text-xl font-mono font-black text-foreground drop-shadow-md\">{progress}%</span>\n          )}\n        </div>\n      </div>\n\n      <button\n        onClick={triggerDownload}\n        disabled={isDownloading}\n        className={cn(\n          \"w-full py-2 rounded-xl text-xs font-bold transition-all shadow-lg cursor-pointer text-center\",\n          isDownloading ? \"bg-zinc-800 text-muted-foreground\" : \"bg-primary text-white hover:bg-primary/95 shadow-primary/10\"\n        )}\n      >\n        {isDownloading ? \"Downloading Bundle...\" : \"Trigger Download\"}\n      </button>\n    </div>\n  );\n}\n"
    }
  ]
}