{
  "name": "ai-output-approval-queue",
  "type": "registry:ui",
  "dependencies": [
    "lucide-react"
  ],
  "files": [
    {
      "path": "components/ui/AiOutputApprovalQueue.tsx",
      "type": "registry:ui",
      "content": "\"use client\";\n\nimport React, { useState } from \"react\";\n\nexport interface QueueItem {\n  id: string;\n  preview: string;\n  category: string;\n  flag?: \"low\" | \"med\" | \"high\";\n  submittedAt: string;\n}\n\nexport interface AIOutputApprovalQueueProps {\n  items?: QueueItem[];\n  accent?: string;\n}\n\nconst DEFAULT: QueueItem[] = [\n  { id: \"i1\", preview: \"Refund processed. Order #4213 was eligible…\",      category: \"support\",     flag: \"low\",  submittedAt: \"12:14\" },\n  { id: \"i2\", preview: \"Recommend switching to Plus tier — saves you 28%…\", category: \"sales\",       flag: \"med\",  submittedAt: \"12:13\" },\n  { id: \"i3\", preview: \"Sorry, I can't help with that medical question…\",  category: \"safety\",      flag: \"high\", submittedAt: \"12:11\" },\n  { id: \"i4\", preview: \"Here's the SQL: SELECT * FROM users WHERE…\",        category: \"engineering\", flag: \"med\",  submittedAt: \"12:08\" },\n];\n\nconst FLAG_COLOR = { low: \"var(--accent)\", med: \"var(--amber)\", high: \"var(--pink)\" };\n\nexport function AIOutputApprovalQueue({ items: defaultItems = DEFAULT, accent = \"var(--accent)\" }: AIOutputApprovalQueueProps) {\n  const [items, setItems] = useState(defaultItems);\n  const dispatch = (id: string) => setItems((p) => p.filter((x) => x.id !== id));\n\n  return (\n    <div\n      style={{\n        width: \"100%\",\n        maxWidth: 460,\n        background: \"var(--bg-2)\",\n        border: \"1px solid var(--edge-2)\",\n        borderRadius: 14,\n        padding: 16,\n        fontFamily: \"var(--font-sans)\",\n      }}\n      role=\"region\"\n      aria-label=\"Approval queue\"\n    >\n      <div style={{ display: \"flex\", justifyContent: \"space-between\", alignItems: \"baseline\", marginBottom: 12 }}>\n        <span style={{ fontFamily: \"var(--font-mono)\", fontSize: 11, letterSpacing: \"0.12em\", textTransform: \"uppercase\", color: \"var(--text-3)\" }}>\n          <span style={{ color: accent }}>●</span> approval queue\n        </span>\n        <span style={{ fontFamily: \"var(--font-mono)\", fontSize: 11, color: \"var(--text-3)\" }}>{items.length} pending</span>\n      </div>\n      {items.length === 0 ? (\n        <div style={{ padding: 30, fontFamily: \"var(--font-mono)\", fontSize: 12, color: accent, textAlign: \"center\" }}>\n          ✓ queue clear.\n        </div>\n      ) : (\n        <div style={{ display: \"flex\", flexDirection: \"column\", gap: 6 }}>\n          {items.map((it) => {\n            const flagColor = it.flag ? FLAG_COLOR[it.flag] : accent;\n            return (\n              <div key={it.id} style={{ padding: \"10px 12px\", background: \"var(--bg)\", border: \"1px solid var(--edge)\", borderLeft: `3px solid ${flagColor}`, borderRadius: 8, display: \"flex\", flexDirection: \"column\", gap: 6 }}>\n                <p style={{ margin: 0, fontSize: 12.5, color: \"var(--text)\", lineHeight: 1.5 }}>{it.preview}</p>\n                <div style={{ display: \"flex\", alignItems: \"center\", gap: 8, fontFamily: \"var(--font-mono)\", fontSize: 10.5, color: \"var(--text-3)\" }}>\n                  <span style={{ padding: \"1px 6px\", borderRadius: 3, background: `color-mix(in srgb, ${flagColor} 18%, transparent)`, color: flagColor, letterSpacing: \"0.08em\", textTransform: \"uppercase\" }}>{it.flag ?? \"low\"}</span>\n                  <span>{it.category}</span>\n                  <span>· {it.submittedAt}</span>\n                  <div style={{ marginLeft: \"auto\", display: \"flex\", gap: 4 }}>\n                    <button type=\"button\" onClick={() => dispatch(it.id)} aria-label=\"Approve\" style={{ width: 26, height: 22, background: accent, color: \"var(--bg)\", border: 0, borderRadius: 4, cursor: \"pointer\", fontWeight: 700 }}>✓</button>\n                    <button type=\"button\" onClick={() => dispatch(it.id)} aria-label=\"Reject\" style={{ width: 26, height: 22, background: \"transparent\", color: \"var(--pink)\", border: \"1px solid var(--pink)\", borderRadius: 4, cursor: \"pointer\", fontWeight: 700 }}>✕</button>\n                  </div>\n                </div>\n              </div>\n            );\n          })}\n        </div>\n      )}\n    </div>\n  );\n}\n"
    }
  ]
}