{
  "name": "parallax-video-showcase",
  "type": "registry:ui",
  "dependencies": [
    "framer-motion",
    "lucide-react"
  ],
  "files": [
    {
      "path": "components/ui/parallax-video-showcase.tsx",
      "type": "registry:ui",
      "content": "'use client';\n\nimport React, { useEffect, useRef, useState } from 'react';\nimport { motion, useReducedMotion } from 'framer-motion';\nimport { Pause, Play, Volume2, VolumeX } from 'lucide-react';\nimport { cn } from \"@/lib/utils\";\n\nexport interface ParallaxVideoShowcaseProps {\n  videoUrl?: string;\n  posterUrl?: string;\n  captionsUrl?: string;\n  captionsLanguage?: string;\n  captionsLabel?: string;\n  title?: string;\n  description?: string;\n  autoPlay?: boolean;\n  className?: string;\n}\n\nexport const ParallaxVideoShowcase: React.FC<ParallaxVideoShowcaseProps> = ({\n  videoUrl,\n  posterUrl,\n  captionsUrl,\n  captionsLanguage = 'en',\n  captionsLabel = 'English',\n  title = 'Parallax video',\n  description = 'Interactive media preview',\n  autoPlay = true,\n  className,\n}) => {\n  const containerRef = useRef<HTMLDivElement>(null);\n  const videoRef = useRef<HTMLVideoElement>(null);\n  const reduceMotion = useReducedMotion();\n  const [offsets, setOffsets] = useState({ x: 0, y: 0 });\n  const [isPlaying, setIsPlaying] = useState(Boolean(videoUrl && autoPlay && !reduceMotion));\n  const [isMuted, setIsMuted] = useState(true);\n  const captionsTrackUrl = captionsUrl ?? 'data:text/vtt;charset=utf-8,WEBVTT%0A%0A';\n\n  useEffect(() => {\n    const video = videoRef.current;\n    if (!video || !videoUrl) return;\n\n    if (autoPlay && !reduceMotion) {\n      void video.play().catch(() => setIsPlaying(false));\n    } else if (!video.paused) {\n      video.pause();\n      setIsPlaying(false);\n    }\n  }, [autoPlay, reduceMotion, videoUrl]);\n\n  const handleMouseMove = (event: React.MouseEvent<HTMLDivElement>) => {\n    if (!containerRef.current || reduceMotion) return;\n    const rect = containerRef.current.getBoundingClientRect();\n    setOffsets({\n      x: (event.clientX - rect.left - rect.width / 2) / 6,\n      y: (event.clientY - rect.top - rect.height / 2) / 6,\n    });\n  };\n\n  const togglePlayback = async () => {\n    const video = videoRef.current;\n    if (!video) return;\n\n    if (video.paused) {\n      try {\n        await video.play();\n      } catch {\n        setIsPlaying(false);\n      }\n    } else {\n      video.pause();\n    }\n  };\n\n  const toggleMuted = () => {\n    const video = videoRef.current;\n    if (!video || !captionsUrl) return;\n    video.muted = !video.muted;\n    setIsMuted(video.muted);\n  };\n\n  return (\n    <div\n      ref={containerRef}\n      onMouseMove={handleMouseMove}\n      onMouseLeave={() => setOffsets({ x: 0, y: 0 })}\n      className={cn(\n        'group relative flex h-48 w-full max-w-[340px] select-none items-center justify-center overflow-hidden rounded-2xl border border-border/40 bg-card shadow-2xl',\n        className\n      )}\n      aria-label={title}\n    >\n      <motion.div\n        animate={\n          reduceMotion ? { x: 0, y: 0, scale: 1 } : { x: -offsets.x, y: -offsets.y, scale: 1.15 }\n        }\n        transition={\n          reduceMotion ? { duration: 0 } : { type: 'spring', stiffness: 180, damping: 22 }\n        }\n        className=\"pointer-events-none absolute inset-0 h-full w-full\"\n      >\n        {videoUrl ? (\n          <video\n            ref={videoRef}\n            src={videoUrl}\n            poster={posterUrl}\n            autoPlay={autoPlay && !reduceMotion}\n            muted={isMuted}\n            loop\n            playsInline\n            preload=\"metadata\"\n            onPlay={() => setIsPlaying(true)}\n            onPause={() => setIsPlaying(false)}\n            className=\"h-full w-full object-cover brightness-90 transition-[filter] duration-300 group-hover:brightness-105\"\n          >\n            <track\n              kind=\"captions\"\n              src={captionsTrackUrl}\n              srcLang={captionsLanguage}\n              label={captionsUrl ? captionsLabel : 'Muted media'}\n              default\n            />\n          </video>\n        ) : (\n          <div\n            data-testid=\"video-placeholder\"\n            className=\"h-full w-full bg-[radial-gradient(circle_at_30%_20%,hsl(var(--primary)/0.35),transparent_38%),radial-gradient(circle_at_75%_70%,hsl(var(--primary)/0.2),transparent_42%),linear-gradient(135deg,hsl(var(--card)),hsl(var(--muted)))]\"\n          />\n        )}\n      </motion.div>\n\n      <div className=\"absolute inset-0 flex flex-col justify-between bg-gradient-to-t from-black/55 via-transparent to-black/10 p-4\">\n        <div className=\"flex w-full items-center justify-between\">\n          <span className=\"rounded-full bg-black/40 px-2 py-0.5 text-[9px] font-black uppercase tracking-widest text-white/80 backdrop-blur-md\">\n            Video showcase\n          </span>\n          <button\n            type=\"button\"\n            onClick={toggleMuted}\n            disabled={!videoUrl || !captionsUrl}\n            aria-label={isMuted ? 'Unmute video' : 'Mute video'}\n            title={!captionsUrl ? 'Provide captionsUrl to enable audio' : undefined}\n            className=\"grid h-8 w-8 place-items-center rounded-full text-white/80 transition-colors hover:bg-black/40 hover:text-white focus-visible:outline-none focus-visible:ring-2 focus-visible:ring-white disabled:cursor-not-allowed disabled:opacity-40\"\n          >\n            {isMuted ? <VolumeX className=\"h-4 w-4\" /> : <Volume2 className=\"h-4 w-4\" />}\n          </button>\n        </div>\n\n        <div className=\"mt-auto flex items-center gap-2\">\n          <button\n            type=\"button\"\n            onClick={() => void togglePlayback()}\n            disabled={!videoUrl}\n            aria-label={isPlaying ? 'Pause video' : 'Play video'}\n            className=\"grid h-8 w-8 shrink-0 place-items-center rounded-full bg-primary text-primary-foreground shadow-lg transition-transform hover:scale-105 focus-visible:outline-none focus-visible:ring-2 focus-visible:ring-white disabled:cursor-not-allowed disabled:opacity-50\"\n          >\n            {isPlaying ? (\n              <Pause className=\"h-3.5 w-3.5 fill-current\" />\n            ) : (\n              <Play className=\"ml-0.5 h-3.5 w-3.5 fill-current\" />\n            )}\n          </button>\n          <div className=\"flex min-w-0 flex-col gap-0.5\">\n            <span className=\"truncate text-[10px] font-extrabold uppercase leading-none tracking-wide text-white\">\n              {title}\n            </span>\n            <span className=\"truncate text-[8px] font-semibold uppercase text-white/60\">\n              {description}\n            </span>\n          </div>\n        </div>\n      </div>\n    </div>\n  );\n};\n"
    }
  ]
}
