{
  "name": "hero-section-mobile-app",
  "type": "registry:ui",
  "dependencies": [
    "framer-motion",
    "lucide-react"
  ],
  "files": [
    {
      "path": "components/ui/HeroSectionMobileApp.tsx",
      "type": "registry:ui",
      "content": "\"use client\";\n\nimport React from \"react\";\nimport { motion } from \"framer-motion\";\nimport { Apple, Play, Star, Check } from \"lucide-react\";\nimport { cn } from \"@/lib/utils\";\nimport { usePrefersReducedMotion } from \"./use-animation-hooks\";\n\nconst FEATURES = [\"Offline-first sync\", \"Biometric lock\", \"Lives in your pocket\"];\n\nexport interface HeroSectionMobileAppProps {\n  className?: string;\n}\n\nexport function HeroSectionMobileApp({\n  className,\n}: HeroSectionMobileAppProps) {\n  const reduced = usePrefersReducedMotion();\n\n  return (\n    <section\n      className={cn(\n        \"w-full max-w-3xl overflow-hidden rounded-2xl border border-border/50 bg-card/45 shadow-xl backdrop-blur-xl font-sans text-foreground\",\n        className,\n      )}\n    >\n      <div className=\"grid items-center gap-6 p-8 sm:grid-cols-2\">\n        <motion.div\n          initial={reduced ? false : { opacity: 0, y: 12 }}\n          animate={{ opacity: 1, y: 0 }}\n          transition={{ duration: 0.4 }}\n        >\n          <span className=\"inline-flex items-center gap-1.5 rounded-full border border-border/60 bg-secondary/40 px-3 py-1 text-xs font-semibold text-muted-foreground\">\n            <Star className=\"h-3.5 w-3.5 fill-amber-400 text-amber-400\" />\n            4.8 on the App Store\n          </span>\n\n          <h1 className=\"mt-4 text-4xl font-black leading-[1.1] tracking-tight sm:text-5xl\">\n            Your money,\n            <br />\n            <span className=\"text-primary\">finally in sync.</span>\n          </h1>\n\n          <p className=\"mt-3 max-w-xs text-base leading-relaxed text-muted-foreground\">\n            Track spending, split bills, and hit savings goals — all from one\n            beautifully simple app.\n          </p>\n\n          <ul className=\"mt-4 space-y-1.5\">\n            {FEATURES.map((f) => (\n              <li\n                key={f}\n                className=\"flex items-center gap-2 text-sm text-muted-foreground\"\n              >\n                <Check className=\"h-4 w-4 text-emerald-400\" />\n                {f}\n              </li>\n            ))}\n          </ul>\n\n          <div className=\"mt-5 flex flex-wrap gap-2.5\">\n            <a\n              href=\"/\"\n              aria-label=\"Download on the App Store\"\n              className=\"inline-flex items-center gap-2 rounded-xl bg-foreground px-4 py-2 text-background transition-opacity hover:opacity-90\"\n            >\n              <Apple className=\"h-5 w-5\" />\n              <span className=\"text-left leading-none\">\n                <span className=\"block text-[11px] opacity-70\">Download on the</span>\n                <span className=\"block text-sm font-bold\">App Store</span>\n              </span>\n            </a>\n            <a\n              href=\"/\"\n              aria-label=\"Get it on Google Play\"\n              className=\"inline-flex items-center gap-2 rounded-xl border border-border/60 bg-secondary/40 px-4 py-2 text-foreground transition-colors hover:bg-secondary/60\"\n            >\n              <Play className=\"h-5 w-5 fill-current\" />\n              <span className=\"text-left leading-none\">\n                <span className=\"block text-[11px] opacity-70\">Get it on</span>\n                <span className=\"block text-sm font-bold\">Google Play</span>\n              </span>\n            </a>\n          </div>\n        </motion.div>\n\n        <motion.div\n          initial={reduced ? false : { opacity: 0, y: 20 }}\n          animate={{ opacity: 1, y: 0 }}\n          transition={{ duration: 0.45, delay: reduced ? 0 : 0.1 }}\n          className=\"flex justify-center\"\n        >\n          <div className=\"relative h-64 w-36 rounded-[2rem] border-4 border-border/70 bg-gradient-to-b from-secondary/60 to-card p-2.5 shadow-2xl\">\n            <span className=\"absolute left-1/2 top-2 h-1 w-10 -translate-x-1/2 rounded-full bg-border\" />\n            <div className=\"mt-4 space-y-2\">\n              <div className=\"rounded-xl bg-primary/15 p-2.5\">\n                <p className=\"text-[8px] font-medium text-muted-foreground/70\">\n                  Balance\n                </p>\n                <p className=\"text-base font-black\">$4,820.50</p>\n              </div>\n              <div className=\"rounded-xl bg-secondary/40 p-2\">\n                <div className=\"flex items-center justify-between\">\n                  <span className=\"text-[8px] font-semibold\">Groceries</span>\n                  <span className=\"text-[8px] font-bold text-rose-400\">−$62</span>\n                </div>\n              </div>\n              <div className=\"rounded-xl bg-secondary/40 p-2\">\n                <div className=\"flex items-center justify-between\">\n                  <span className=\"text-[8px] font-semibold\">Payday</span>\n                  <span className=\"text-[8px] font-bold text-emerald-400\">\n                    +$2,100\n                  </span>\n                </div>\n              </div>\n              <div className=\"h-12 rounded-xl bg-gradient-to-t from-emerald-400/25 to-transparent\" />\n            </div>\n          </div>\n        </motion.div>\n      </div>\n    </section>\n  );\n}\n"
    },
    {
      "path": "components/ui/use-animation-hooks.ts",
      "type": "registry:file",
      "content": "import { useEffect, useRef, useState } from 'react';\nimport type { RefObject } from 'react';\n\nexport const usePrefersReducedMotion = (): boolean => {\n  const [prefersReducedMotion, setPrefersReducedMotion] = useState(false);\n\n  useEffect(() => {\n    const mediaQuery = window.matchMedia('(prefers-reduced-motion: reduce)');\n    setPrefersReducedMotion(mediaQuery.matches);\n\n    const listener = (event: MediaQueryListEvent) => {\n      setPrefersReducedMotion(event.matches);\n    };\n\n    mediaQuery.addEventListener('change', listener);\n    return () => {\n      mediaQuery.removeEventListener('change', listener);\n    };\n  }, []);\n\n  return prefersReducedMotion;\n};\n\nexport const useAnimateOnScroll = (options?: IntersectionObserverInit) => {\n  const [ref, setRef] = useState<HTMLElement | null>(null);\n  const [isIntersecting, setIsIntersecting] = useState(false);\n\n  useEffect(() => {\n    if (!ref) return;\n\n    const observer = new IntersectionObserver(([entry]) => {\n      if (entry) {\n        setIsIntersecting(entry.isIntersecting);\n      }\n    }, options);\n\n    observer.observe(ref);\n    return () => {\n      observer.unobserve(ref);\n    };\n  }, [ref, options]);\n\n  return [setRef, isIntersecting] as const;\n};\n\nexport function useInView<T extends Element = HTMLDivElement>(\n  options: IntersectionObserverInit = { rootMargin: '100px 0px', threshold: 0 },\n): [RefObject<T | null>, boolean] {\n  const ref = useRef<T | null>(null);\n  const [inView, setInView] = useState(false);\n  useEffect(() => {\n    const el = ref.current;\n    if (!el || typeof window === 'undefined' || !('IntersectionObserver' in window)) {\n      setInView(true);\n      return;\n    }\n    const io = new IntersectionObserver(([entry]) => setInView(entry.isIntersecting), options);\n    io.observe(el);\n    return () => io.disconnect();\n  }, [options]);\n  return [ref, inView];\n}\n\nexport function useShouldAnimate<T extends Element = HTMLDivElement>(): [RefObject<T | null>, boolean] {\n  const reduced = usePrefersReducedMotion();\n  const [ref, inView] = useInView<T>();\n  return [ref, inView && !reduced];\n}\n"
    }
  ]
}