{
  "name": "primary-action-button",
  "type": "registry:ui",
  "dependencies": [],
  "files": [
    {
      "path": "components/ui/primary-action-button.tsx",
      "type": "registry:ui",
      "content": "\"use client\";\n\nimport React, { useState } from \"react\";\n\nexport type ButtonVariant = \"primary\" | \"secondary\" | \"ghost\" | \"destructive\";\nexport type ButtonSize = \"sm\" | \"md\" | \"lg\";\n\nexport interface PrimaryActionButtonProps {\n  label?: string;\n  variant?: ButtonVariant;\n  size?: ButtonSize;\n  loading?: boolean;\n  disabled?: boolean;\n  icon?: string;\n  accent?: string;\n  onClick?: () => void;\n}\n\nconst SIZE: Record<ButtonSize, { h: number; px: number; fs: number; gap: number }> = {\n  sm: { h: 30, px: 12, fs: 12.5, gap: 6 },\n  md: { h: 38, px: 16, fs: 13.5, gap: 8 },\n  lg: { h: 46, px: 22, fs: 15, gap: 10 },\n};\n\nexport function PrimaryActionButton({\n  label = \"Ship it\",\n  variant = \"primary\",\n  size = \"md\",\n  loading: loadingProp,\n  disabled = false,\n  icon = \"→\",\n  accent = \"var(--accent)\",\n  onClick,\n}: PrimaryActionButtonProps) {\n  const [internalLoading, setInternalLoading] = useState(false);\n  const loading = loadingProp ?? internalLoading;\n  const dim = SIZE[size];\n  const off = disabled || loading;\n\n  const styles = (() => {\n    switch (variant) {\n      case \"secondary\":\n        return {\n          bg: \"var(--bg-3)\",\n          color: \"var(--text)\",\n          border: \"1px solid var(--edge-2)\",\n          shadow: \"none\" as const,\n          hoverBg: \"var(--bg-4)\",\n        };\n      case \"ghost\":\n        return {\n          bg: \"transparent\",\n          color: accent,\n          border: `1px solid transparent`,\n          shadow: \"none\" as const,\n          hoverBg: \"color-mix(in srgb, \" + accent + \" 12%, transparent)\",\n        };\n      case \"destructive\":\n        return {\n          bg: \"var(--pink)\",\n          color: \"var(--bg)\",\n          border: \"1px solid var(--pink)\",\n          shadow: \"0 0 18px -6px var(--pink)\" as const,\n          hoverBg: \"var(--pink)\",\n        };\n      default:\n        return {\n          bg: accent,\n          color: \"var(--bg)\",\n          border: `1px solid ${accent}`,\n          shadow: `0 0 18px -6px ${accent}`,\n          hoverBg: accent,\n        };\n    }\n  })();\n\n  const handleClick = () => {\n    if (off) return;\n    if (loadingProp === undefined) {\n      setInternalLoading(true);\n      window.setTimeout(() => setInternalLoading(false), 1400);\n    }\n    onClick?.();\n  };\n\n  return (\n    <button\n      type=\"button\"\n      onClick={handleClick}\n      disabled={off}\n      aria-busy={loading}\n      style={{\n        height: dim.h,\n        padding: `0 ${dim.px}px`,\n        display: \"inline-flex\",\n        alignItems: \"center\",\n        gap: dim.gap,\n        background: styles.bg,\n        color: styles.color,\n        border: styles.border,\n        borderRadius: 8,\n        fontFamily: \"var(--font-sans)\",\n        fontSize: dim.fs,\n        fontWeight: 500,\n        cursor: off ? \"not-allowed\" : \"pointer\",\n        opacity: off && !loading ? 0.5 : 1,\n        boxShadow: styles.shadow,\n        position: \"relative\",\n        overflow: \"hidden\",\n        transition: \"transform 0.15s ease, box-shadow 0.15s ease, background 0.15s ease\",\n        outline: \"none\",\n      }}\n      onMouseEnter={(e) => {\n        if (off) return;\n        e.currentTarget.style.transform = \"translateY(-1px)\";\n        if (variant === \"primary\" || variant === \"destructive\") {\n          e.currentTarget.style.boxShadow = styles.shadow.replace(\"-6px\", \"-2px\");\n        }\n      }}\n      onMouseLeave={(e) => {\n        e.currentTarget.style.transform = \"translateY(0)\";\n        e.currentTarget.style.boxShadow = styles.shadow;\n      }}\n    >\n      {loading ? (\n        <span\n          aria-hidden=\"true\"\n          style={{\n            width: dim.fs,\n            height: dim.fs,\n            borderRadius: \"50%\",\n            border: `2px solid currentColor`,\n            borderTopColor: \"transparent\",\n            animation: \"ai-spin-slow 0.7s linear infinite\",\n          }}\n        />\n      ) : null}\n      <span>{loading ? \"Working\" : label}</span>\n      {!loading ? (\n        <span aria-hidden=\"true\" style={{ fontFamily: \"var(--font-mono)\", transition: \"transform 0.18s ease\" }}>{icon}</span>\n      ) : null}\n    </button>\n  );\n}\n"
    }
  ]
}