{
  "name": "ai-conversation-export-panel",
  "type": "registry:ui",
  "dependencies": [],
  "files": [
    {
      "path": "components/ui/ai-conversation-export-panel.tsx",
      "type": "registry:ui",
      "content": "\"use client\";\n\nimport React, { useState } from \"react\";\n\nexport type ExportFormat = \"json\" | \"markdown\" | \"pdf\" | \"txt\";\n\nexport interface AIConversationExportPanelProps {\n  formats?: ExportFormat[];\n  defaultFormat?: ExportFormat;\n  messageCount?: number;\n  sizeKb?: number;\n  accent?: string;\n}\n\nconst FORMAT_META: Record<ExportFormat, { label: string; glyph: string; ext: string }> = {\n  json:     { label: \"JSON\",     glyph: \"{}\", ext: \".json\" },\n  markdown: { label: \"Markdown\", glyph: \"md\", ext: \".md\" },\n  pdf:      { label: \"PDF\",      glyph: \"▦\",  ext: \".pdf\" },\n  txt:      { label: \"Plain\",    glyph: \"T\",  ext: \".txt\" },\n};\n\nconst SAMPLE_BY_FORMAT: Record<ExportFormat, string> = {\n  json: `{\n  \"id\": \"conv_4213\",\n  \"model\": \"claude-opus-4-7\",\n  \"messages\": [\n    { \"role\": \"user\", \"content\": \"Build a settings page\" },\n    { \"role\": \"assistant\", \"content\": \"On it…\" }\n  ]\n}`,\n  markdown: `# Conversation · conv_4213\n**Model:** claude-opus-4-7\n\n### User\nBuild a settings page\n\n### Assistant\nOn it…`,\n  pdf: \"Binary PDF (~ 142 KB) · 4 pages\",\n  txt: `[user]      Build a settings page\n[assistant] On it…`,\n};\n\nexport function AIConversationExportPanel({\n  formats = [\"json\", \"markdown\", \"pdf\", \"txt\"],\n  defaultFormat = \"markdown\",\n  messageCount = 28,\n  sizeKb = 14,\n  accent = \"var(--accent)\",\n}: AIConversationExportPanelProps) {\n  const [format, setFormat] = useState<ExportFormat>(defaultFormat);\n  const [copied, setCopied] = useState(false);\n\n  const handleCopy = () => {\n    if (typeof navigator !== \"undefined\") navigator.clipboard?.writeText(SAMPLE_BY_FORMAT[format]);\n    setCopied(true);\n    window.setTimeout(() => setCopied(false), 1200);\n  };\n\n  return (\n    <div\n      style={{\n        width: \"100%\",\n        maxWidth: 440,\n        background: \"var(--bg-2)\",\n        border: \"1px solid var(--edge-2)\",\n        borderRadius: 14,\n        padding: 16,\n        fontFamily: \"var(--font-sans)\",\n        display: \"flex\",\n        flexDirection: \"column\",\n        gap: 12,\n      }}\n      role=\"region\"\n      aria-label=\"Export conversation\"\n    >\n      <div style={{ display: \"flex\", justifyContent: \"space-between\", alignItems: \"baseline\" }}>\n        <span style={{ fontFamily: \"var(--font-mono)\", fontSize: 11, letterSpacing: \"0.12em\", textTransform: \"uppercase\", color: \"var(--text-3)\" }}>\n          <span style={{ color: accent }}>●</span> export · {messageCount} msgs\n        </span>\n        <span style={{ fontFamily: \"var(--font-mono)\", fontSize: 11, color: \"var(--text-3)\" }}>~{sizeKb} KB</span>\n      </div>\n\n      <div role=\"radiogroup\" aria-label=\"Export format\" style={{ display: \"grid\", gridTemplateColumns: \"repeat(4, 1fr)\", gap: 6 }}>\n        {formats.map((f) => {\n          const meta = FORMAT_META[f];\n          const active = f === format;\n          return (\n            <button\n              key={f}\n              type=\"button\"\n              role=\"radio\"\n              aria-checked={active}\n              onClick={() => setFormat(f)}\n              style={{\n                display: \"flex\",\n                flexDirection: \"column\",\n                alignItems: \"center\",\n                gap: 4,\n                padding: \"10px 4px\",\n                background: active ? \"var(--bg-3)\" : \"var(--bg)\",\n                border: `1px solid ${active ? accent : \"var(--edge)\"}`,\n                borderRadius: 8,\n                cursor: \"pointer\",\n                transition: \"all 0.15s\",\n                boxShadow: active ? `0 0 12px -4px ${accent}` : \"none\",\n              }}\n            >\n              <span aria-hidden=\"true\" style={{ fontFamily: \"var(--font-mono)\", fontSize: 14, color: active ? accent : \"var(--text-3)\", fontWeight: 700 }}>\n                {meta.glyph}\n              </span>\n              <span style={{ fontSize: 11, color: active ? \"var(--text)\" : \"var(--text-3)\" }}>{meta.label}</span>\n            </button>\n          );\n        })}\n      </div>\n\n      <pre\n        style={{\n          margin: 0,\n          padding: 12,\n          background: \"var(--bg)\",\n          border: \"1px solid var(--edge)\",\n          borderRadius: 8,\n          fontFamily: \"var(--font-mono)\",\n          fontSize: 11,\n          color: \"var(--text-2)\",\n          lineHeight: 1.5,\n          maxHeight: 140,\n          overflowY: \"auto\",\n          whiteSpace: \"pre\",\n        }}\n      >\n        <code>{SAMPLE_BY_FORMAT[format]}</code>\n      </pre>\n\n      <div style={{ display: \"flex\", gap: 8 }}>\n        <button\n          type=\"button\"\n          onClick={handleCopy}\n          style={{\n            flex: 1,\n            height: 34,\n            background: copied ? \"var(--accent-soft)\" : \"transparent\",\n            color: copied ? accent : \"var(--text-2)\",\n            border: `1px solid ${copied ? accent : \"var(--edge-2)\"}`,\n            borderRadius: 7,\n            cursor: \"pointer\",\n            fontFamily: \"var(--font-mono)\",\n            fontSize: 12,\n          }}\n        >\n          {copied ? \"✓ copied\" : \"⎘ copy text\"}\n        </button>\n        <button\n          type=\"button\"\n          style={{\n            flex: 1,\n            height: 34,\n            background: accent,\n            color: \"var(--bg)\",\n            border: 0,\n            borderRadius: 7,\n            cursor: \"pointer\",\n            fontWeight: 500,\n            fontSize: 12,\n            boxShadow: `0 0 12px -4px ${accent}`,\n          }}\n        >\n          ↓ download {FORMAT_META[format].ext}\n        </button>\n      </div>\n    </div>\n  );\n}\n"
    }
  ]
}