{
  "name": "banner-early-access",
  "type": "registry:ui",
  "dependencies": [
    "framer-motion",
    "lucide-react"
  ],
  "files": [
    {
      "path": "components/ui/banner-early-access.tsx",
      "type": "registry:ui",
      "content": "\"use client\";\n\nimport React from \"react\";\nimport { motion, useReducedMotion } from \"framer-motion\";\nimport { Sparkles, ArrowRight } from \"lucide-react\";\nimport { cn } from \"@/lib/utils\";\n\nexport interface BannerEarlyAccessProps {\n  className?: string;\n  /** Number of seats taken so far. */\n  taken?: number;\n  /** Total seats available. */\n  total?: number;\n}\n\n/** Invite-only early access banner with a progress meter showing remaining seats. */\nexport function BannerEarlyAccess({\n  className,\n  taken = 1840,\n  total = 2500,\n}: BannerEarlyAccessProps) {\n  const reduced = useReducedMotion();\n  const headingId = React.useId();\n  const pct = Math.min(100, Math.round((taken / total) * 100));\n  const remaining = Math.max(0, total - taken);\n\n  return (\n    <motion.section\n      aria-labelledby={headingId}\n      initial={reduced ? false : { opacity: 0, y: 12 }}\n      animate={{ opacity: 1, y: 0 }}\n      transition={{ duration: 0.5 }}\n      className={cn(\n        \"relative isolate w-full overflow-hidden rounded-2xl border border-primary/30 bg-gradient-to-r from-primary/15 via-accent/15 to-primary/15 p-1.5 shadow-lg shadow-primary/10\",\n        className,\n      )}\n    >\n      <div className=\"rounded-xl bg-card/80 p-5 backdrop-blur-xl sm:p-6\">\n        <div className=\"flex flex-col gap-4 sm:flex-row sm:items-center sm:justify-between\">\n          <div className=\"flex items-start gap-3\">\n            <span className=\"grid h-10 w-10 flex-shrink-0 place-items-center rounded-xl bg-primary/15 text-primary\">\n              <Sparkles className=\"h-5 w-5\" aria-hidden />\n            </span>\n            <div>\n              <span className=\"inline-block rounded-full bg-primary/15 px-2 py-0.5 text-[10px] font-bold uppercase tracking-wider text-primary\">\n                Invite only\n              </span>\n              <h2 id={headingId} className=\"mt-1 text-base font-semibold text-foreground sm:text-lg\">\n                Forge v4 — closed beta is taking shape.\n              </h2>\n              <p className=\"mt-1 max-w-md text-xs leading-relaxed text-muted-foreground\">\n                Request access to try the new runtime, branching API, and edge-first dashboards\n                ahead of the public launch.\n              </p>\n            </div>\n          </div>\n          <a\n            href=\"#request\"\n            className=\"group inline-flex flex-shrink-0 items-center gap-2 self-start rounded-xl bg-primary px-4 py-2.5 text-sm font-semibold text-primary-foreground shadow-lg shadow-primary/25 transition-opacity hover:opacity-90 focus-visible:outline-none focus-visible:ring-2 focus-visible:ring-[var(--ring)] sm:self-auto\"\n          >\n            Request access\n            <ArrowRight className=\"h-4 w-4 transition-transform group-hover:translate-x-0.5 motion-reduce:transition-none\" aria-hidden />\n          </a>\n        </div>\n\n        <div className=\"mt-5\">\n          <div className=\"flex items-center justify-between text-[11px] font-semibold uppercase tracking-wider text-muted-foreground\">\n            <span>\n              <span className=\"text-foreground\">{taken.toLocaleString()}</span> of {total.toLocaleString()} seats claimed\n            </span>\n            <span className=\"text-primary\">{remaining.toLocaleString()} left</span>\n          </div>\n          <div\n            className=\"mt-2 h-2 overflow-hidden rounded-full bg-background/60\"\n            role=\"progressbar\"\n            aria-valuenow={pct}\n            aria-valuemin={0}\n            aria-valuemax={100}\n            aria-label=\"Seats claimed\"\n          >\n            <motion.div\n              initial={reduced ? false : { width: 0 }}\n              animate={{ width: `${pct}%` }}\n              transition={{ duration: 0.9, ease: \"easeOut\" }}\n              className=\"h-full rounded-full bg-gradient-to-r from-primary via-accent to-primary\"\n            />\n          </div>\n        </div>\n      </div>\n    </motion.section>\n  );\n}\n\nexport default BannerEarlyAccess;\n"
    }
  ]
}