{
  "name": "mobile-app-install-banner",
  "type": "registry:ui",
  "dependencies": [
    "lucide-react"
  ],
  "files": [
    {
      "path": "components/ui/MobileAppInstallBanner.tsx",
      "type": "registry:ui",
      "content": "\"use client\";\n\nimport React, { useState } from \"react\";\nimport { AppWindow, Star, ArrowRight } from \"lucide-react\";\n\nexport function MobileAppInstallBanner() {\n  const [active, setActive] = useState(true);\n\n  if (!active) return null;\n\n  return (\n    <div className=\"w-full max-w-2xl bg-card/45 backdrop-blur-xl border border-border/50 p-4 rounded-xl shadow-lg select-none font-sans text-foreground flex flex-col sm:flex-row items-center justify-between gap-3 relative overflow-hidden\">\n      <div className=\"absolute inset-0 bg-gradient-to-r from-violet-500/10 via-transparent to-transparent pointer-events-none\" />\n      \n      <div className=\"flex items-center gap-2.5 relative z-10\">\n        <div className=\"p-2 rounded-lg bg-violet-500/15 border border-violet-500/20 text-violet-400\">\n          <AppWindow className=\"w-4 h-4\" />\n        </div>\n        <div className=\"text-xs\">\n          <h4 className=\"font-black leading-none mb-1 text-violet-300\">Download Mobile app</h4>\n          <div className=\"flex items-center gap-2 text-[10px] text-muted-foreground/60\">\n            <span className=\"flex items-center gap-0.5\"><Star className=\"w-3 h-3 fill-yellow-400 text-yellow-400\" /> 4.9</span>\n            <span>•</span>\n            <span>Scan QR Code to install</span>\n          </div>\n        </div>\n      </div>\n\n      <button className=\"px-3.5 py-1.5 bg-primary hover:brightness-110 text-white text-[10px] font-extrabold rounded-lg flex items-center gap-1 transition-all relative z-10\">\n        <span>Install PWA App</span>\n        <ArrowRight className=\"w-3 h-3\" />\n      </button>\n    </div>\n  );\n}"
    }
  ]
}
